901,,旧魔法学校,かつて一大勢力を築いた魔法学校が解体されて,新たに設立された学校。魔法大戦以前は魔法を,専門に扱っていたが戦争の終結を期に魔法学科,が廃止され旧魔法学校という名称に変更された。,入学にはスカウトか多額の費用を要する。その,ため各地方の名家や貴族が多く集まっている。,,,,
904,,第三地区,魔法学校に隣接する自治区。代々由緒ある魔法,使いが治めていたが戦時中に代替わりしたため,政情は不安定になっている。,,,,
907,,秘密の裏山,第三地区から近くある裏山。マモノが棲みつ,いているため普段は誰も近づかない。,,,,
910,,時計塔,旧魔法学校の敷地内にある建築物。５階建てで,中は螺旋階段になっている。利用者は多くない,が逢瀬場所として生徒たちの間では密かな人気,スポットになっている。,,,,
913,,喫茶店,\N[2]が働いているお店。元々はマスターが一人,で酒場を営んでいたが\N[2]が養子になり昼は喫,茶店、夜は酒場として営業するようになった。,,,,
916,,盗賊のアジト,第三地区から離れた区画に位置する洞窟。盗賊,たちが市場や裏取引で入手した金品や貴重品を,保管していた。,,,,
919,,魔法学校,黒水晶の力により勢力を延ばした組織。大陸一,の軍事力を持ったが、魔法大戦と結晶化騒動を,経て衰退し解体した。かつての領土は戦争前の,各地方の領主に返還している。,,,,
922,,北部雪原地帯,北部雪原地帯は黒い雪の夜が降った場所であり,マモノの活動が活発である。人の往来が少なく,小さな集落が点在している。一年中雪に覆われ,ており集落はそれぞれ独自の文化を持っている。,,,,